投诉问题,投诉对象,发布日期,投诉要求,投诉内容
 兑换奖品半年都没收到,宁波银行,2021年12月31日 13:16, 落实奖品,2021年6月30日在宁波银行app中的筑梦空间中兑换了一台小米小爱音箱，因为一直没有收到奖品，10月底开始联系宁波银行客服，客服给了一个订单号，但是到快递点去查询核实到快递系统里面并没有这个件，我也始终没有收到过相关通知。从11月初开始基本每周都和客服沟通，要求客服及时回电告知处理情况，但从未收到反馈电话。每次说是和快递公司核实有关情况，但从未告知具体核实情况，也一直不予反馈。6月底兑换的一台音箱，半年过去了，马上进入2022年了，截止目前仍然没有任何消息，没有任何核实结果，没有任何电话反馈。因为宁波银行app里面不支持截长图，放了一部分聊天记录进来。
 申请延期还款,宁波银行,2021年12月29日 17:51, 申请延期还款,与2021年开始陆续向宁波银行直接贷贷款，未还金额约一万元？因现在疫情又没有工资又放假了！现在实在没有还了，想个性话分期还款，本人有意愿还款！只是现在实在没办法了！
" 虚假宣传,终端设备故障",宁波银行,2021年12月29日 14:04," 解释,改善服务",助力了十个人之后，其他人助力显示助力已满，实际情况是并没有助力完成。故意不让助力虚假宣传
 虚假宣传,宁波银行,2021年12月28日 14:49, 解释,宁波银行宁来花虚假宣传，推出一个活动，拉人助力，说了每天有50名额，我领取了名额，然后拉人助力，两个人绑我助力，然后第三个人帮我助力就助力不了，虚假宣传
" 冻结账户,利息高，乱冻结账户",宁波银行,2021年12月24日 21:18," 退款,解释,改善服务,解封账户",打电话给95574说卡被冻结，客服说在深圳房地产行业不支持，解冻不了，换了惠州公司交社保，说地区不支持？万利金给金额的时候隔三差五打电话来说利息多低多好，给利息优惠券什么的，现在我说还不起那么多，让我找家人朋友借？和家人借了五万都还进去了，找你们工作人员协商说分期长一点，让我找家人朋友借？有钱我找你借吗？
 查我的征信问题,宁波银行,2021年12月24日 10:34, 解释,本人没有在宁波银行办理过业务，为什么会3次查我的征信。就在前几天又查询了一次。本人没有在宁波银行办理过贷款，为什么会有贷款审批，贷后管理。查我的征信应明确告知本人是宁波银行查询，是办理什么业务？还是什么合作机构？事情经过应让当事人(本人)心里知根知底。
 无法按时还款影响征信,宁波银行,2021年12月22日 22:42," 解释,赔偿",还款日无法还款 因为本人征信有其他需要使用 不能有逾期 今天还款日无法还款 如果上了征信这责任谁承担 设定规则时候要带上脑子 还款日 顾名思义晚上12点之前 我会在凌晨维护后还上 请给个合理说法 如果后续上了征信负面记录你们要承担法律责任
" 客服服务态度差,不作为,违规授信额度",宁波银行,2021年12月21日 12:49, 协商解决欠款问题,本人因出现经济困境，导致多家银行欠款逾期，其他银行已经协商好分期，宁波银行欠款额度最大，多次找他们电话协商，他们都不作为，不解决。明知我有协商意愿还委托催收人员多次打电话刁难，说我恶意拖欠，对我的生活工作造成影响，我明明逾期后已经第一时间向他们致电说明情况，并表达协商意愿。
 功能限制,宁波银行,2021年12月20日 16:31," 解释,改善服务",本人因为疫情现在导致逾期，工资不能按时发放，我希望能够给再给延期一下，希望能够给我一个机会
 乱扣费,宁波银行,2021年12月20日 14:45, 退款,2021年12月20日上午中移电子商务有限公司-宁波银行2从本人的中国银行卡上扣费49.57元，没说明原因，也没发短信通知，我是通过中国银行网银才知道的，不需要你的同意，也不需要任何缘由就这样把你的钱划走了，想想都后怕，这次扣你几十，下次说不准扣你几百几千的。。希望尽快给我退款并说明原因
 恶意查询征信信息,宁波银行,2021年12月15日 15:56," 赔偿,道歉",因个人原因查询征信报告，发现《宁波银行股份有限公司》以《贷后管理》的名义查询我的个人征信，未经本人授权，本人要求该公司做出相应解释，并删除此次查询记录.
 虚假宣传,宁波银行,2021年12月14日 21:57, 退款,宁波银行信用卡的宁好星期四活动，在上周四无锡一鸣真鲜活动领券后，并未如优惠券上描述执行16减15的活动，多次询问客服，客服表示这是地区性活动，限制参加卡的归属地，我的卡是上海办理的卡，所以不能参加，客服态度倨傲！问题是优惠券和活动说明详情均未提及该活动限制信用卡归属地而非持卡人所在地，该企业行为涉及虚假宣传，诱导消费，欺诈消费，要求道歉并按照活动退费，更正虚假行为！
 恶意让客户逾期,宁波银行,2021年12月11日 10:07, 赔偿,上月无法扣款，联系客服解决，这月又无法扣款给了个账户无法存款，恶意让客户造成逾期
 直接贷,宁波银行,2021年12月11日 02:30, 销户,因要申请贷款业务，申请上去拒贷，原因是有宁波银行直接贷产品，共有两个账户，查询后发现是使用花呗冲突，关闭花呗后还有一个账户未销户，期间一直联系宁波银行电话 得到的回复均是等待客服回复，现在政府部门都在推行最多跑一次  而我三番四次给银行打电话都无法解决，去宁波银行网点又和我讲这个是线上业务 他们查不到也没有权限
 贷款利率17%,宁波银行,2021年12月09日 21:09, 退还利息,宁波银行直接贷业务年化利息高达17%，超出规定的12%，本人还款长达11个月，希望宁波银行把多收的利息退还
 万利金,宁波银行,2021年12月09日 18:48, 退款,万利金贷款提前还款多收取手续费等费用。办理时候没有告知
" 虚假宣传,资金流失",宁波银行,2021年12月09日 16:19, 退款,宁波银行黄岩支行利用低利息虚假宣传招揽客户  实际支付利息远高于宣传利息 客户向网点反应后 一直推脱不解决  诉求 宁波银行按照宣传时的利息计算  并反还多付的利息
" 终端设备故障,客服服务态度差",宁波银行,2021年12月04日 11:04," 解释,改善服务,延期还款一年",尊敬的国家领导:我叫李江波，我在2020年12月20日.2021年7月20日，2021年10月17日分别借了三笔直接贷借款，我在老家开小饭店好食客，这些贷款分别用在装修店面上了，到目前为止因为疫情影响店里生意很差，我请求宁波银行给我延期还款，我目前没有还款能力，但是我打电话协商他们银行不受理，每天都让催收部门打电话催收严重影响了我的正常生活希望有关部门领导帮我处理一下。让一个老百姓正常的做生意。谢谢
 白领融延期问题,宁波银行,2021年12月04日 00:55, 解封额度，顺利延期,2018年12月宁波银行到我单位上门帮我办理了三年的白领融20万元信用贷款额度。后面我正常使用，他们将我额度提升至40万。期间我正常使用，如期还款，最近一次还款，是在十月份，我还清两笔共24万贷款加利息2.8万元。后面10月份客服告知我，我的额度被冻结，不能正常使用和顺利延期两年。要我提供房产记录，或者找一个共同还款人之后才可以解封额度和办理延期。我选择找共同还款人，花费一些时间。后面直销银行客服找我了解情况，当面答应我只要我还清12月30日的一笔贷款，就可以帮我顺利解封额度和办理两年延期。不料两天后再询问客服，却改变说法，要求我还清一半贷款，才可以帮我解封额度和办理延期。而且延期只能持续一年，额度也减半了。客服说辞前后不一，我信用良好，从未逾期，却要将我额度减半，有不合理条件延期，这太不合理了。我信用良好，有能力如期还款，希望银行可以维持我的40万额度，然后帮我顺利延期两年。
" 拒绝协商还款,恶意起诉",宁波银行,2021年12月03日 17:45," 协商还款,撤诉",本人之前在宁波银行汇通信用卡借款总额度16万，还了3万多，后来卡片被银行冻结无法使用，现在欠款128***。本人因做生意失败，无力还款，后来导致卡片逾期，曾经多次打电话给银行并且也过去银行支行希望能够和他们协商分期还款，本人有强烈的还款意愿，不是恶意拖欠，但是无法一次性还款那么多，结果银行多次拒绝分期还款。今天收到一条法院起诉短信，但是我在中国审判网上以及打电话12368查询，都没有查询到该起诉，不知道起诉是真是假，我这是无力一次性偿还欠款，不是恶意拖欠。希望黑猫能够介入一下，希望那边能协商还款并且撤诉
" 被起诉,拒绝协商还款",宁波银行,2021年12月02日 22:12," 同意协商还款,撤诉",本人于2020年6月由于资金紧张在滴滴打车平台贷款，出款方是宁波银行，在这期间正常按期还款，由于疫情原因失去工作，没有稳定的收入，失去经济来源，无奈逾期7047元一直未还，如今生计已然成为问题，无奈联系宁波银行协商还款被拒，现投诉宁波银行恶意起诉一事，望宁波银行同意协商还款，并撤销诉讼。
 违法催收,宁波银行,2021年12月02日 15:48," 解释,停止骚扰他人",在宁波银行办理了直接贷业务，因为本人发生变故事情，收入断裂，以及其他的贷款，目前全部处于逾期状态。之前一直很宁波银行协商希望能够协商还款，贷款重组，联系我的人一直拒绝协商，并让我进行还款。给让我还款有还款记录，我根据目前的情况只还了一点进去，那个人工作人员就生气骂我，在我不知情的情况下联系我村里的人，并每天电话骚扰律师函威胁，对我造成严重困扰。 希望宁波银行能给我一个合理的解释，停止对村里人的电话骚扰，并协商一个双方都满意的还款方案
 违法催收,宁波银行,2021年12月02日 13:07," 解释,改善服务",在宁波银行办理了直接贷业务，因为生病，收入断裂，以及其他的贷款，目前全部处于逾期状态。之前一直很宁波银行协商希望能够协商还款，贷款重组，联系我的人一直拒绝协商，并让我进行还款。给让我还款有还款记录，我根据目前的情况只还了一点进去，那个人工作人员就生气骂我，在我不知情的情况下联系我村里的人，并每天电话骚扰，对我造成严重困扰。希望宁波银行能给我一个合理的解释，停止对村里人的电话骚扰，并协商一个双方都满意的还款方案
" 功能限制,冻结账户",宁波银行,2021年11月29日 09:52, 解释,就把我的卡限制了，现在在我的卡取钱取不了，转账也转不了
" 合作商户不诚信,终端设备故障",宁波银行,2021年11月28日 19:00," 解释,改善服务,赔偿",6-7月份因为该公司系统有问题扣款当天没有扣款成功，我的账户是够钱扣的，他们没有扣款成功就发信息说我逾期，后来就扣了我的逾期费用几块钱，我打电话过去问，就说很抱歉会解决，我就想几块钱就算了，他们也一直迟迟没有解决 。后来更过分，8月28号7点多扣款成功，8点多发信息说我逾期，29-30号还不断发信息说我逾期，还打电话说我逾期，还好我有记录，然后他们知道是他们的问题说会给我解决，后面就不了了之，在后面更过分，我账户每个月都存有足够的钱够他们扣款，他们9月份开始系统那边扣款不成功，也不提醒，直到我查征信，发现征信被黑有问题了才知道他们系统有问题却还黑我征信，希望可以给个合理的解释，并改善系统，我不想因为几百块就让自己信用有问题，更何况这不是我个人导致的，到现在我卡里的钱他们还不扣 好一直不大电话过来解决。
" 合作商户不诚信,冻结账户,私自扣款",宁波银行,2021年11月27日 19:44," 退款,解释,改善服务,赔偿,解封账户",本人通过有钱花平台借款100***万分三期，还款形式等额等息，第一笔还款到期11月22日，11月23号10：33还款34035.77（产生利息1400），等待大约2分钟有钱花软件显示还欠款，于10：35又还款34035.77结果我银行卡提示扣款两次，立马联系有钱花商家，商家说第二笔款项可以作为下期还款提前还款，不做退换，本期账单已结束这期间产生利息700多，等于我白交，这个案件牵扯到两家机构，一个是机构：有钱花，另一个就是放款方：宁波银行，宁波银行收到这笔款项肯定不做退换，也不想退利息，那么有钱花也不想吃亏，你不退，我也不会吃亏，我也不退。问题来了有钱花属于网贷机构，可以耍赖。宁波银行是政府机构他们耍赖，有网贷作为挡箭牌。很简单一个例子：我去银行取钱，银行多给我100块钱，他们会打电话要我还回去，否则就认为我违法，但是宁波银行作为国家单位，消费者由于网络问题被造成误转款，他们也不是吃素的，钱我不还，问题退给网贷平台。搞起了幕后人！
 手机上自动乱扣费,宁波银行,2021年11月26日 12:31, 退款,我觉得电子银行扣费必须得告知我们被扣费者扣费的原因是什么
 信用卡自动分期,宁波银行,2021年11月24日 23:30, 取消自动分期,信用卡在宁波银行app激活后，收到了开启自动分期的短信通知。此类给用户带来额外支出的功能，在未经用户显式许可和知情同意的情况下开启，侵犯了用户的权益。并且该银行还设置霸王条款，分期一经开启，再也无法关闭。
" 服务不到位,无协商还款政策",宁波银行,2021年11月24日 13:47," 改善服务,提供停息挂账延长还款",遭遇变故，个人债务全面逾期，联系银行客服表示平台“直接贷”业务逾期无协商还款政策，需按合同规定，有罚息。本人名下贷款、信用卡已全面逾期，有还款意愿，需协商还款
 宁波银行直接贷,宁波银行,2021年11月23日 18:18," 解释,改善服务",我于今年11.14号在宁波银行直接贷借款逾期九天，宁波银行客服在可以联系到我的情况下打电话骚扰我的家人并且让我家人偿还，我不理解我借的的钱为何要让我家人偿还，你有什么事找我谈话，找我家里人是什么意思。我希望给我一个合理解释！
 未开个人全部贷款结清,宁波银行,2021年11月23日 14:11, 开个人全部贷款结清,宁波银行没给开个人全部贷款结清证明，目前只给开单笔50元结清证明，导致无法贷款，需要开下。
 私自扣款,宁波银行,2021年11月22日 22:13, 退款,11月20上午，我妈的建设银行突然收到一条扣款信息，当时她并没有任何消费行为，不知道扣款原因是什么。我登陆她的手机银行查询到扣款地方为中移电子商务有限公司-宁波银行2，我上网查询同时发现了几起显示投诉订单，说明这种无故扣款的操作常常发生，请宁波银行给予我解释并退款。
 催收太厉害,宁波银行,2021年11月18日 15:02," 道歉,改善服务,停息挂账,禁止暴力催收",本人因家庭原因欠下贷款，现在因无力偿还希望通过银行协商，挂账停息，延长还款期限，第三方催收公司多次暴力催收，一直骚扰我，还打电话到我们单位。这样被单位知道，我会被开除，到时候经济来源都没有，我想要跟银行协商，希望银行回复，到时候被开除就真的一点都还不起
 功能限制,宁波银行,2021年11月17日 23:16," 解释,改善服务",经宁波银行业务部人员多次营销，本人于9月份使用了直接贷业务，但通过APP还款不正常，在限额内还款10多次，偶尔成功一次，不知是技术原因还是故意+，请作出解释并尽快解决。附图。
 提前还款收高额违约金,宁波银行,2021年11月17日 22:03, 免收违约金,宁波银行万利金 采用信用卡分期手续费形式 加本金还款，但如果提前还款会收取剩余额度的3%，实际换算隐藏的利息的非常高。 可理解为多收一年的利息钱。同时希望银保监会重视此类银行各种隐藏问题
" 冻结账户,私自扣款,资金流失",宁波银行,2021年11月17日 12:25," 改善服务,解封账户",生意问题，现在宁波银行直接贷预期还不上，欠款本金两万多，在六月份的时候就一直协商分期，银行一直不同意，可是我一下子拿不出来这么多钱。现在直接冻结了我的工资卡，现在跟银行律师协商分六期，然后申请减免利息，也一直不愿意跟我协商。现在是要把我逼上绝路了，冻结我的工资卡，现在连生活费都没有。家里都是靠我一个人。希望银行能多给我几期时间。
 个性化分期，停息挂账,宁波银行,2021年11月15日 21:55, 改善服务,本人目前资金链断联，因为疫情关系等原因导致目前无法偿还每期款项，申请停息挂账，个性化分期48期，给我足够的时间。还款日从2022年1月30日开始。在此期间，请不要有任何的暴力催收行为，以及自动划扣我银行卡，联系紧急联系人等无关人员，若造成任何名誉，生活，工作等行为，将进行维权。恳请机构予以同步谅解。
 霸王条款，欺诈消费者,宁波银行,2021年11月15日 10:34, 改善服务,银行工作人员一直打电话推销直接贷，一直正常还款，循环贷只能还款额度冻结，霸王条款讲綜合评分不好，那你为啥一直打电话推销叫我贷款，现在用了循环贷，又只能还，不能贷 ，霸王条款欺诈，要求恢复额度
 宁波银行金融违归扣钱,宁波银行,2021年11月12日 12:00, 协商还款,您好！本人受宁波银行金融贷款违规侵扰，已严重影响本人身心健康和家庭不和，宁波银行投诉宁波银行金融活动过程中以下多条违规操作，严重危害社会和谐稳定： 1、违规放贷和冻结！2019年7月宁波银行直销未考虑本人的收入情况，简单通过身份证便向本人放贷50万贷款额度，并许诺额度有效期3年，2020年初因为疫情缘故，本人家庭困难，多次向银行等金融机构申请贷款业务，宁波银行得知后，在该笔贷款额度未到期及本人正常还款无逾期情况下，未通知本人即冻结贷款额度，造成本人要一次性还本金加利息55万多，本人多方筹集资金还款本金加利息28余万。 2、故意隐瞒贷款相关信息！其中一笔欠款10万元，在未通知本人情况下由永安财产保险公司代偿，债权已转移，银行工作人员在本人不知情情况下与本人协商包括该笔10万元债务的还款协议，且诱导本人每月还款优先还该笔代偿10万元贷款以外的银行剩余贷款17万。 3、宁波直销银行违规催收！在剩余本金27万时，宁波银行催收本人及配偶，并到本人所在单位拍照催收等，最后本人与其银行工作人员达成还款协议，每个月还五千年底一次性还三万，即年还9万直至还清所有本金及利息，本人遂在2020年10月起按与其工作人员约定每月还款5千，年度一次性还三万直至2021年三月已还6.5万。 4、不同意协商！2021年四月，在本人正常按约定还款下，永安财产保险公司起诉本人，本人告知已与宁波银行达成还款协议，对方称不知情，本人遂通过法官与律师与其协商新的还款，尽自己最大所能每月还款1万，对方完全不顾本人家庭、抚养孩子等困难，不同意协商。 5、不顾人民死活！2021年7月对方申请执行，冻结本人银行卡和微信等账户，本人上有两个70岁老人，农民职业，常年疾病缠身，配偶无工作，两个小孩，一个小学，一个幼儿园，嗷嗷待哺，女儿还患有下颌前突畸形需十几万手术费用，仅靠本人一人工资养活全家六口人，本人竭尽所能与对方协商每月还款一万，对方无视民众困难，完全不顾我死活，造成本人极度困难。 6、高利息违规！2021年8月，宁波银行剩余本金20.5万，起诉于我，两年之内涨到29万多，利息达18%以上，远超国家规定正常利息。 尊敬的领导，本人在家庭极度困难情况下，仍有强烈还款意愿配合银行工作，但对方完全不顾我死活，造成本人孩子无法进行手术，老人生病也不敢去医院，妻子家庭分裂不和，本人诉求仅仅是对方同意协商！
 恶意让客户逾期,宁波银行,2021年11月11日 11:17, 赔偿,2021年11月10日还款，还款账户资金充足，无法扣款，手动还款失败，联系银行，不解决，导致逾期，加收费用
 终端设备故障,宁波银行,2021年11月11日 00:11, 退款,10月10日，直接贷的款还完后，一直提示3-5分钟短信通知结果，也一直没通知结果！（银行卡里的钱是重组的）。操作多次都是这样，换了个银行卡也是这样。款当天还不上，第二天又多计算利息！一个不是很小的银行，还上市公司，竟然是这样的体验，也不知道是故意的，还是技术问题？？？投诉！！！
 直接贷冻结,宁波银行,2021年11月10日 10:21," 解释,解封账户",为什么突然冻结额度？2023年7月到期，为什么冻结，没有一期逾期。
 功能限制,宁波银行,2021年11月05日 22:16," 解释,改善服务,赔偿",宁波银行的客服打我电话，让我办理贷款业务，办理过后刚开始是每月还上分期贷款，然后又能取出来，就像信用卡一样每月按时还上，就可以继续消费，但这个宁波银行突然一下，只能还款不能提款，搞的我措手不及，现在即将面临逾期，感觉被套路贷款了
 虚假宣传,宁波银行,2021年11月03日 19:32," 解释,赔偿",这不是虚假宣传吗，拉人申请贷款，以100立减为噱头，结果发的兑换码用过的，已拉群为目的，这个活动已经上个月结束了，没有支付金额，
" 合作商户不诚信,私自扣款,客服服务态度差",宁波银行,2021年10月31日 14:41," 退款,解释,改善服务,赔偿",在查看信用卡账单时发现4000多的一笔消费自动分期36期，客服推脱，不解决，在没有通知本人的情况下，私自信用卡满2000即分36期，且不能取消。在办卡时未告知有消费自动分期事由，现在只能提前还款由此产生了的163元手续费
" 分期还款,分期还款",宁波银行,2021年10月28日 02:46, 要求分期还,2020年宁波银行直接贷工作人员电话主动联系我本人，要求我办理直接贷业务，当时本人并没有直接办理，时隔几小时直接贷工作人员再次电话联系我，让我一步一步操作并办理直接贷业务金额开通，在工作人员软磨硬泡中我开通了直接贷业务，开通金额26000元，金额开通借出后到每期还款的时候突然发现利息不是一般的高。请问在这种情况下宁波银行是如何得到我本人的联系方式？在要求我开通该业务的同时是否对我本人的资质有所了解以及审核。在这种情况下该银行是否涉及到引诱贷款耳并未考虑到还款人后期的情况，金额分期期限是否太短？现在所剩的16000元我希望能分期12期还款。
 多方骚扰,宁波银行,2021年10月27日 15:46, 改善服务,本人在去年九月底接到宁波银行直接贷工作人员电话，当时有资金需要，借了一笔，第二天就全款还进去了，还进款项当天就有工作人员打电话来说可以给我优惠利息，送了我券，多次提醒我借款出来使用，后面借款25000，分一年期，先息后本，目前已经到期，利息全部还了，本金由于个人负债原因暂时未归还，再联系到我本人的情况下，催收人员在一个月内每天多次骚扰家人，打电话给村委，给村子里面人说我欠款情况。每天给我家人造成心里压力。
" 功能限制,直接贷贷款陷阱,故意还款金额限制,打电话客服不能解决,电话来催款不听解释,电话催款说完就挂电话",宁波银行,2021年10月26日 15:12," 取消不合理的逾期罚息,解除贷款合同,取消征信上报",宁波银行刚开始三天两头打电话来说可以APP贷款，贷完后自动还款14123元失败才发现有限制还款5000元，APP又不能拆分还款（打电话来说直接存到贷款银行卡就可以）投诉客服说反应到后台解决，没有结果。电话来催款给他说原因，不听催完款就直接挂掉。APP一直显示逾期。之前打电话给办贷款电话也打不通。
