投诉问题,投诉对象,发布日期,投诉要求,投诉内容
 虚假宣传,宁波银行,2022年05月14日 19:42, 赔偿,宁波银行以拉人组团送红包为由，诱导我参加了他们的活动，原活动规则是每组成五十人团平分500红包，14日十点领取，到了十点他们公众号领奖公众号一直打不开，后来他们公众号发布公告说下午三点重新领取。到了三点还是一直卡，领奖渠道进不去，我从三点弄到三点四十才进去，被告知红包被领完了，送了500积分。他们不遵守原有活动规则，临时篡改活动规则。现要求按原有规则发放给活动红包。
 虚假宣传,宁波银行,2022年05月14日 19:42," 退款,解释",虚假宣传引流，欺骗消费者，活动说明50人平分500元，实际只有积分没有红包
 虚假宣传,宁波银行,2022年05月14日 19:40, 补发赠品,邀请50人组团平分500，后来在周三擅自改了规则，变成了先到先得
 虚假宣传,宁波银行,2022年05月14日 19:40, 赔偿,宁波银行宁来花微信公众号，虚假宣传，组团五十人平分五百元红包。到了开奖时间，根本进不了活动页面，到了最后说红包没了
 虚假宣传,宁波银行,2022年05月14日 19:39, 赔偿,活动开始前说好是组团平分红包，并没有说是先到先得，活动开始后人数过多我整整卡了1个小时才进了活动，结果开奖却变成了积分，让我相当无语。
" 虚假宣传,客服服务态度差",宁波银行,2022年05月14日 19:39," 解释,改善服务,赔偿",我于几天前参加了宁波银行组团分红包的活动 50个人瓜分500的红包 本来是今天八点开奖 宁波银行单方面取消用户抽奖资格 后面致电客服的情况下才重新选择开奖时间 然后今天下午三点开奖 我进去抽到的不是红包 而是抽到的积分与活动规则奖品不符合 这种情况完全是虚假宣传
 虚假宣传,宁波银行,2022年05月14日 19:38, 赔偿,创建虚假活动，以50人组团瓜分500的标题，引诱客户组团，非法搜集客户资料，组团成功后用户长时间无法进入活动页面领取红包，即使进入也是500积分，没有所谓宣传的50人瓜分500元，随意更改活动规则，存在严重的欺诈行为
 虚假宣传活动,宁波银行,2022年05月14日 19:37," 解释,赔偿",微信公众号宁波银行宁来花虚假宣传组团五十人平分五百元红包，到了抽奖时间，就一直进不去卡了几个小时进去了就是给你积分  之前规则说的清清楚楚分红包
 虚假宣传,宁波银行,2022年05月14日 19:36," 解释,改善服务,赔偿",创建虚假活动，以50人组团瓜分500的标题，引诱客户组团，非法搜集客服资料，组团成功后用户长时间无法进入活动页面领取红包，即使进入也是2元红包跟500积分，没有所谓宣传的50人瓜分500元，存在严重的欺诈行为。
 虚假宣传,宁波银行,2022年05月14日 19:36, 赔偿,最早开始他们关于这个活动的宣传是只要关注他们公众号然后入团参加这个活动达到人数就平分这个活动的红包，但是等到活动结束开奖的时候，突然就变成了先到先得，和平分一点关系都没有了，把用户当傻子，以为用户全都失忆了，我严重怀疑他们就是骗取用户关注和用户的个人信息。
" 合作商户不诚信,虚假宣传,客服服务态度差",宁波银行,2022年05月14日 19:34," 退款,改善服务,赔偿",我参加了宁波银行组团分红包的活动50个人分500块钱的红包今天三点开奖 我进去直接抽到的是积分和活动规则里面的分红包不符合宁波银行完全是设立虚假活动非法收集用户资料
 虚假宣传,宁波银行,2022年05月14日 19:32, 赔偿,创建虚假活动，以50人组团瓜分500的标题，引诱客户组团，非法搜集客服资料，组团成功后用户长时间无法进入活动页面领取红包，即使进入也是2元红包跟500积分，没有所谓宣传的50人瓜分500元，存在严重的欺诈行为，活动与实际不服，虚假宣传。何止诱导拉人，拉完人还诱导贷款
 虚假宣传,宁波银行,2022年05月14日 19:32, 赔偿,说邀请多少个人分多少奖励，我拉了5个人然后说奖励分完了？你们活动规则有说先到先得？那既然没说，为什么红包不给，反而开奖就给积分？是不是涉嫌虚假宣传？你们银行办活动都是一刀切的？
 虚假宣传,宁波银行,2022年05月14日 19:31, 赔偿,5月7起宁波银行花起组团领红包活动，50人组队瓜分500元。等到5月14日时开奖，突然加入一个消息，奖品数量是有限的，活动从10点卡到下午4点半。然后进去送了没用的积分，严重虚假宣传。
 虚假宣传,宁波银行,2022年05月14日 19:30," 解释,赔偿",虚假活动 说好的50人平分500元 结果确是2元 诱导别人参加活动 要求补偿
" 虚假宣传,随意更换规则,钓鱼,搜集客户信息,设备终端网络问题",宁波银行,2022年05月14日 19:30," 赔偿,改善服务,补发赠品",创建虚假活动，以50人组团瓜分500的标题，引诱客户组团，非法搜集客服资料，组团成功后用户长时间无法进入活动页面领取红包，即使进入也是2元红包跟500积分，没有所谓宣传的50人平分500元，存在严重的欺诈行为。本来说的是5月14日上午十点50人平分500元，然后，进去缺不能领取，并且显示已经领取过。然后更改至下午三点抢，然而到点进不去，进去的人只领到2块钱，然后一看，上午跟下午的规则完全不同。我至少邀请身边30多人，大多数人到3点能进不去领取。并且进去领取并没有宣传所说平分10块红包。要求道歉赔偿。
 虚假宣传,宁波银行,2022年05月14日 19:28, 赔偿,活动14号规定就可以开红包，结果呢上午直接显示抽过了，不让抽，修复后，推到下午3点重新抽红包，好家伙到了下午3点活动进都进不去，你可真行啊，还是那句话，办不起活动别办，这一整个就是虚假活动？！
 虚假宣传,宁波银行,2022年05月14日 19:25," 解释,赔偿",宁波银行前段时间出了个组团分红包活动，活动规则是全员平分，等今天开始瓜分时候又要限量，那不是抢红包吗何为平分？而且活动页面卡了我一个小时只给没有的积分，我还邀请了几个朋友都是积分，我怀疑根本没有现金红包，作为银行如此无信，我感觉很失望和气愤，要求给我解释解释
 虚假宣传,宁波银行,2022年05月14日 19:24, 赔偿,宁波银行开的参团分红包，拉了好多人，最后没给红包，规则上说的平分红包，到开奖的时候不能进，要不就是给的金额很低，明显虚假宣传，恶意篡改活动。
 虚假宣传,宁波银行,2022年05月14日 16:31, 赔偿,微信公众号宁波银行宁来花虚假宣传组团平分五百元红包，到了抽奖时间，进不去活动页面
 虚假宣传,宁波银行,2022年05月14日 16:20," 退款,解释,改善服务,赔偿",活动领取一直加载中没领取选项.......
 虚假宣传,宁波银行,2022年05月14日 16:09, 赔偿,宁波银行宁来花微信公众号，虚假宣传，组团五十人平分五百元红包。到了开奖时间，根本进不了活动页面，到了最后说红包没了
 虚假宣传,宁波银行,2022年05月14日 16:05, 赔偿,宁波银行宁来花开团活动，规则清清楚楚写的开团50人平分500元，我拉了两天才拉够50人，开始说14号12点开奖，结果进去显示已开奖，但没一个人收到奖励，后面又发公告说15点，15点登上去卡得要死就算，好不送卡了十几分钟才进去，结果就分了2元？50人平分500，说好的人人10元变成2元？玩不起就不要玩，人家拉人很辛苦知道吗？把别人当猴子耍？
 虚假宣传,宁波银行,2022年05月14日 16:04, 赔偿,宁波银行宁来花虚假宣传组团平分红包活动，到了开奖时间，根本立进不去！
 虚假宣传,宁波银行,2022年05月14日 16:01, 赔偿,今天早上进去的时候故意限制不给领，后面突然把规则改了，人人瓜分红包的，后面一直进不去，非常生气，浪费了我那么多时间，要不是你们举办活动为了宣传银行？自己正规把奖励发放，谁会投诉你们？睁大眼睛看时间，用数据Wi-Fi都进不去，故意拖
 虚假宣传,宁波银行,2022年05月14日 16:01, 赔偿,宁波银行虚假活动，拉人头组团活动，50人平分500元，一开始5月14上午10点开奖，结果却说我已经抽过了，中午又出补偿方案，结果14点登录不上去，一直到15点才登录上去，却发现红包领完了！
 虚假宣传,宁波银行,2022年05月14日 15:57, 赔偿,说好的50个人拼团成功平分500元，辛辛苦苦凑够50个人 现在进去说没有了
 虚假宣传,宁波银行,2022年05月14日 15:56, 赔偿,微信公众号宁波银行宁来花虚假宣传组团五十人平分五百元红包，到了抽奖时间，开始是一直转圈，过了四十分钟，返回再进入抽奖，不给红包！
 虚假宣传,宁波银行,2022年05月14日 15:52, 赔偿,微信公众号宁波银行宁来花，虚假宣传，组团五十人平分五百元红包，不给红包！
" 钓鱼纠纷,虚假宣传,终端设备故障",宁波银行,2022年05月14日 15:46," 退款,解释,改善服务,赔偿",活动14号规定就可以开红包，结果呢上午直接显示抽过了，不让抽，修复后，推到下午3点重新抽红包，好家伙到了下午3点活动进都进不去，你可真行啊，还是那句话，办不起活动别办，丢人
 虚假宣传,宁波银行,2022年05月14日 15:44, 赔偿,微信公众号-宁波银行宁来花，前几天有个组团五十人平分五百元的红包活动，今天开奖，不给红包，给的积分，虚假宣传虚假活动虚假银行！
 虚假宣传,宁波银行,2022年05月14日 15:31," 解释,赔偿",宁波银行宁来花微信公众号组团领红包活动，宣传的时候是组满50人平分500元红包，结果领取的时候只有2元。虚假宣传欺骗用户。
 虚假活动,宁波银行,2022年05月14日 10:37, 虚假活动,前几天宁波银行宁来花举办的组团分红包活动，当时规则写的是邀请50人进团瓜分500红包，如果有人申请宁来花金额可翻倍，今天10点开奖，刚刚去，说还开过奖了，但是根本没有收到红包短信或者100积分，我问了跟我一起参团的朋友，都没有收到，我现在怀疑宁波银行虚假宣传骗人去申请贷款，请给我一个合理的解释
" 虚假宣传,活动作假",宁波银行,2022年05月14日 10:20, 解释,前几天宁波银行宁来花公众号举办的组团分红包活动，当时活动规则写的是邀请50人进团瓜分500元红包（每人10元红包），如果有人申请宁来花贷款额度红包会翻倍，今日10点开奖领红包，刚刚本人10点准点去领取说我开过奖了，我朋友也是领的红包，我咨询了我邀请进团的好多人，都反馈说没开奖或者是领到100积分，严重怀疑宁波银行这个活动存在虚假宣传，根本没有派发红包出来，甚至骗人申请宁来花贷款，请宁波银行出来做个解释
 假货,宁波银行,2022年05月11日 22:20, 解释,查了银行征信发现有一笔不明贷款，显示宁波银行股份有限公司与2021年十月11日发放50000人民币其他个人消费贷款。
" 终端设备故障,还款失败",宁波银行,2022年05月11日 17:06," 退款,解释,改善服务,赔偿,解封账户",宁波银行App直接贷出现严重Bug还款弹出乱码，验证码输入框多次按下不能输入，一直提示还款处理中，导致还款失败，强制令我逾期，罚息，报送信用报告，请给出一个说法
 暴力催收,宁波银行,2022年05月10日 12:11, 停止骚扰,本人在百度有钱花贷了一笔钱，不知道是宁波银行放的款，本人做餐饮行业，受疫情的影响导致赔了很多钱，入不敷出，导致在百度有钱花弄贷款款逾期了，逾期第一天遭到平台的暴力的催收，一下午很多电话，态度恶劣给我的家人打电话，说我们没有人格严重侮辱，给平台客服打电话反应说明情况，一直没有人回应，威胁恐吓说联系村委居委和亲朋好友调查，催收人员态度恶劣，崔收严重影响我和家人的正常生活
 拒绝协商还款,宁波银行,2022年05月09日 17:52," 解释,改善服务,协商还款",宁波银行信用卡，不允许用户协商还款，停息挂账，说话不算数，一会一个答案，而且每个月产生高额的罚息，按商业银行信用卡业务监督管理办法》第70条规定：在特殊情况下（特殊情况是指天灾人祸，被坑被骗，意外事故等），确认信用卡欠款金额超出持卡人还款能力、且持卡人仍有还款意愿的，发卡银行可以与持卡人平等协商，达成个性化分期还款协议。个性化分期还款协议的最长期限不得超过5年（60个月）。本人多次表示还款意愿，宁波银行还是不停的罚息，实在是难以承受。
 违法放贷,宁波银行,2022年05月05日 00:56, 解释,宁波银行在本人不知情情况下操作贷款涉及金额37000，要求予以解释
 直接贷,宁波银行,2022年05月04日 18:30, 申请延期,本人在宁波银行直接贷贷款5万，现在还剩1万多快钱没还，我不是恶意拖欠，确实是生活困难无法还款，但是直接贷完全不给一点余地，直接不协商，要求还全款，要么就起诉，你们客服在给我打电话推销直接贷的时候怎么没这个态度？我有还款意愿，但是现在困难，请求直接贷给予延期还款政策
 虚假宣传,宁波银行,2022年05月04日 04:55," 退款,解释,赔偿",年初收到一个宣传电话说是可以低利息贷款，正好疫情 想着说利息低可以试试用用，承诺我说月息0.3，但是申请后台显示不止这个，我不敢信，业务员承诺我说等我提款后会给我打折，我本着是银行的贷款相信他们，所以提款了。起初后台一直看不到信息，业务员告诉我说等出账单，结果第一期账单出来，利息根本没有打折，我去问说第一期肯定要按照实际还，后台提申请要等到月底统一审批，我相信了，傻傻还了第一期，结果第二期账单出来，又是没有，我找业务员直接不回我信息了，想提前还款还有3个点违约金我的诉求：银行按照承诺给我的5折计算利息，退还已经多还的利息
" 功能限制,工作人员失职",宁波银行,2022年04月29日 03:53," 改善服务,解封账户",由于办理抵押贷款工作人员失职房产评估500多w，所有材料办理完毕后可以贷款，后期进行了回访，由于私人手机号码致电与我，本人以为是电话虚假，故没有接听，后再次回访本人，本人也积极配合，只因没有拍摄公司照片门头，导致贷款失败，后向宁波银行总部投诉，只有当地银行客服发了一条微信，草草了事，后也再一次配合提交相关材料，工作人员推来推去，目前还没有办理好，我想说的是明明第一次完全办理好的贷款程序，由于你们工作人员的工作失误，为什么言而无信！再说办理的是抵押贷款，几百万的评估价，房产证还在你们那里，第一次签的协议不做数吗？出尔反尔，说停贷就停贷一声不吭，讲信用吗？才贷了一年不到，还款期还有几年就这么烦，明明是你们招揽客户内部管理问题，店大欺客
 提前分期还款收违约金,宁波银行,2022年04月28日 21:41, 提前还款取消违约金,本人2019年八九月份贷款的万利金30万，分96期，每期金额3125元，每期手续费1573.69元。还了32期，两年八个月。今天打算提前还款，告诉我要付3%违约金。如果半年内或者一年内提前还款，银行有这个规定，那是我的责任。本人都还32期了，有哪家银行规定满两年八个月提前还要收3%违约金的？宁波银行吃相是否难看，是否霸王条款，是否让还满96期才没有违约金？请主管部门给本人做主，还我应得利益。
 无协商还款政策,宁波银行,2022年04月28日 11:50," 改善服务,改善服务延期还款",家人重病加疫情影响，个人债务全面逾期，联系银行客服表示平台“直接贷”业务逾期无协商还款政策，需按合同规定，有罚息。本人名下贷款、信用卡已全面逾期，有还款意愿，需协商还款
" 客服服务态度差,直接贷不可以协商还款,年利率高于14.6",宁波银行,2022年04月28日 11:27, 协商还款，调整利息,由于疫情期间经济不景气宁波银行直接贷逾期了，想协商还款。不看不知道自己的利息是这么高，年利率高于14.6%，要求降低利息，把之前的多收的利息退回！
 乱收费用,宁波银行,2022年04月27日 23:34, 取消收费,贷款时未告知情况下，宁波银行万利金提前还款收取手续费用，随意冻结账户，至无法使用，信用卡取信用卡功能
 虚假宣传,宁波银行,2022年04月26日 11:21, 返还权益,4月6号宁波银行信用卡公众号抢了3000➖300的支付宝优惠券，绑定到了支付宝账号，4.8号去的银泰买了3000消费卡，优惠券没抵扣，当时联系了电话客服未予处理，4.9联系了微信客服未予处理，优惠券4.10到期，后银行单方面反馈说买的消费卡所以不能享受优惠，可4.8到4.10都未反馈导致优惠券过期，这段时间宁波地区又处于疫情反复阶段，银行这种行为相当的无语，优惠券活动页面以及银行活动规则没有一条提示优惠券不能购买消费卡
" 客服服务态度差,恶意催收,发文件老家威胁家人",宁波银行,2022年04月25日 20:27," 解释,改善服务,合理给出还款方案",过年刚来上班就遇到疫情上几天班休息几天每个月拿两三千元 我还每个月拿出一千多来还款 生活都没保障了 每天还要收到一大堆催收电话今天更是直接发催收文件到老家。和客服说明原因也不理 今天这个催收言语更是恶劣 我从13W还到2W多之前从来没有逾期碰到疫情才会出现逾期现在还款金额已超过收入金额实在还不上请求银行方面给出合理的还款方案
 钓鱼纠纷,宁波银行,2022年04月25日 16:03, 协商分期还款,宁波银行直接贷2018电话推销让我申请直接贷 当时额度15000，且是循环额度，使用期间一直没有逾期正常还款，去年突然清0，只能还款，每个还款需要还款10000左右，目前我已还了118***多元，还剩31000多元 希望协商还款周期。宁波银行电销的时候没有提前告知会突然降额，由于前年做生意失败加上去年今年的疫情影响没挣到什么钱，今年2月开始逾期期间也联系协商分期还款，一直没什么消息，突然今天说要发律师函起诉，这样的做事方式给我带来巨大的困难 资金链断裂 生活难以维持，现在还在天天被疫情影响，隔离在家接近一个月没有一点收入，生活已经难以维持，还要接受第三方的催收的威胁，已经对我的生活造成了严重的影响
 合作商户不诚信,宁波银行,2022年04月25日 12:41," 解释,改善服务,赔偿",我是宁来花合作伙伴，宁来花二维码经常失效，损失很多客户。重新生成二维码也是经常失效。导致客户对我的质疑不信任！用户流失量大，使我信用度受损！我也不能推荐成功！银行得给我补偿！海报下面是4月30号有效，刚生成二维码时不时就失效了，活动有效期与海报不符合！ 每次跟客服沟通，都是半天不回信息！我只有通过投诉来处理这件事！我希望银行能尽快处理此事！感谢
 虚假宣传,宁波银行,2022年04月24日 15:18, 取消提前还款手续费,宁波银行万利金，利息计算方式和贷款完全不一样，时间越久利息越高，还到后面利息远远高于宣传，所以申请退了，但退出还要收取3％手续费，不合理，要求取消。
 他人冒用，他人冒用,宁波银行,2022年04月23日 07:19, 改善服务,本人QQ邮箱接连几个月收到陌生人的信用卡账单，本身没办过宁波银行任何卡
 暴力催收,宁波银行,2022年04月22日 10:02," 改善服务,赔礼道歉",宁波银行泄露个人隐私信息，让委托第三方暴力催收债权人，在本人没有失联的情况下对本人进行暴力催收，打电话到本人公司泄露个人隐私信息，对本人造成负面影响，面临失业和无法进行业务洽谈的影响。
" 客服服务态度差,拉人头",宁波银行,2022年04月21日 20:31," 解释,改善服务",4月20日朋友推荐说明宁波开始有拉人头活动，分享海报给朋友，拉5忍可以得到20京东卡，我通过海报进群之后拉了5人之后没有获得奖励，就加了群主也就是宁波的客服，叫石国娟，他和我说需要走她的链接扫码然后分享自己的海报拉人才算成功，我也就没纠结前面5人失败的事情，后面再次拉人发现群已满，拉人失败，就联系客服石海娟的电话，她说让我等待，今天不开新群了，我也就作罢，当时答应我第二天开群联系我，等到21日下午也没有回复，通过朋友知道活动再次开启，我就照常继续拉人，发现无论我如何拉人，都显示群被举报，不可以拉人，但是我朋友其他人都可以拉人进群，我就再次联系客服，她说了一通屁话，后面问他如何解决，也没有得到答复，意思就一个，你前面拉人不算，现在拉人进不了群也没办法，就是一个劲的敷衍，后面直接以她很忙拒不回复消息，电话也是不接，微信直接拉黑我，我问她为什么要通过拉人进去的方式奖励京东卡，拉了十几个群几千人的目的是什么，单纯做福利也没见过哪家银行是通过拉人进群的方式，我想知道这种操作是不是属于欺诈，作为一个银行，拉几千人入群目的何在，作为一个客服，拉黑我是什么道理，说要处理最后的处理方式就是不处理，消失了，银行聚众拉人合理吗，到底是为了什么
" 私自扣款,客服服务态度差,自动扣款",宁波银行,2022年04月21日 11:49," 退款,改善服务",我的宁波信用卡在我不知晓的情况下。短信和电话没有通知。就直接把我储蓄卡的钱给扣除了。这钱是我下个月的房租钱。你扣了我下个月在哪里住房。找客服解决问题，客服也没有答复。宁波银行严重影响到我下个月的生活！
 虚假宣传,宁波银行,2022年04月21日 09:23," 解释,改善服务",宁波银行员工发布任务说开通宁来花只要成功出额度就能获得任务佣金以及银行发的微信红包。结果我开通了，没有得到相应的报酬！而且这个员工态度很嚣张！我多次跟宁波银行客服反馈此事，他们每次都是敷衍了事！银行给员工任务是拉十个人开通宁来花就能获得一台苹果13手机！并不在乎员工采取什么手段获取！(包括坑蒙拐骗)银行的这种行为等于默认了此事，充当保护伞！我希望有关部门能够对此事此人做出相应的处罚！感谢了
 私自扣款,宁波银行,2022年04月20日 13:53, 退款,2022年月22日上午中移电子商务有限公司-宁波银行2从本人的中国银行卡上扣费69.32元，没说明消费什么，我是通过手机短信才知道的，不需要你的同意，也不需要任何缘由就这样把你的钱划走了，想想都后怕，这次扣你几十，下次说不准扣你几百几千的。。希望尽快给我退款并说明原因
 私自扣款,宁波银行,2022年04月20日 09:13, 退款,每个月乱扣84.49元，没有提示，不知道是因为什么扣款
 宁波银行直接贷,宁波银行,2022年04月19日 13:53, 停止诉讼协商分期还款,目前身上资金无力偿还全部债务，，希望可以协商分期还款，联系你们客服也不管用
 冻结账户,宁波银行,2022年04月19日 02:37, 解封账户,本人2019年11月份申请的白领通三年期，因客户经理当时并未告知本人这笔代款要一年一调头，这么重要的信息我本人，还说这笔钱是可以自动续期的，一直在误导我，倒致我逾期，我从经多次去宁波银行协商还款为果，现所有卡被冻解，倒致我无法生话，一点生活费都没有希望能尽快帮我处理，给我一丝希望，帮我分期解卡，我还有子女要养活
 违约金收取不合理,宁波银行,2022年04月18日 13:18, 退款,我的宁波银行卡分期逾期，主动还款时，银行未电话或告知，直接出账单扣除违约金和利息8300多元。4月我计划一次性还款却可以协商违约金，但已经扣除的部分不予计算。就是逾期后主动还部分款比一次都不还，拖着欠款，最后一起还款交的违约金还要多。申请银行减免，银行不处理。
 无理由不同意协商还款,宁波银行,2022年04月17日 11:35, 改善服务,希望银行不要通过第三方催收来协商还款，我只愿意接到95574的客服沟通电话
