投诉问题,投诉对象,发布日期,投诉要求,投诉内容
 逾期电话骚扰,宁波银行,2021年06月16日 12:51, 直接贷逾期电话骚扰,由于本人于今年五月份从原公司离职，一直未找到合适的工作，失去了收入来源，所以贷款没办法及时偿还，造成逾期，而且我父母都已经退休，没有偿还能力，在我逾期后宁波银行客服打电话给我父母说是确认我的情况，实际却是威胁和恐吓我的家人，造成我家人精神和心理严重受损，我后面主动打电话和宁波银行协商还款，该银行客服和我说没有这个业务的，并且继续威胁我走流程，进入起诉流程。我有这个还款意愿，但是宁波银行却拒绝我的诉求，现向黑猫投诉该银行。
 虚假宣传,宁波银行,2021年06月15日 22:56, 退款,2020年9月，宁波银行客服经理打电话推销所谓的万利金，当时说得天花乱坠，说刚好有利息打折优惠券，强烈推荐我办理，在他们工作人员的说服下，我办理了18万利金3年期，每期还本付息，当初说利率打五折，但还了几期我才发现这里面利息其实很高，因为后期本金少了，利率还是那么高，发现利息计算不是当初客户经理宣传的那样，我就申请提前还款，办理时也说是可以提前还款，但却要高额的提前还款手续费，剩余本金3%，要4200元，这这算起来比高利贷还高。所以强烈要求宁波银行帮我免掉所谓的提前还款手续费，让我尽快还清贷款！！！并请有关部门严查宁波银行这种被很多老百姓普遍投诉的虚假宣传欺骗行为。
" 客服服务态度差,不及时处理",宁波银行,2021年06月15日 15:56, 及时处理,我在6月初，接到两条短信，起诉我要求全部结清，我第一时间给宁波银行打电话，协商还款事项并核实短信的真实性，后来过了两天给我回电话，说短信确实是贷后部门处理的结果，我并承诺在10号左右一次性结清，工作人员说，结清后把电话打进去，他们做撤诉处理，到现在我一次性结清已经有四个工作日，我在还完后的第一时间打电话进行处理，直到今天客服一直没有给我处理，反而法院和律师事务所给我打电话，态度特别不好，说哟处理了么，我说我早就处理了，她们让我发截图，当时工作人员不是这样承诺的，直说我还完后给宁波银行打电话，至今未给我处理，我要求宁波银行给我道歉并及时处理。因为工作不作为，不及时处理客户的反馈，已经影响了我的正常工作。
 多比借款信息,宁波银行,2021年06月14日 17:27, 解释,未在宁波银行借款却收到多比借款短信希望宁波银行给个合理解释
 拖欠贷款近三个月,宁波银行,2021年06月12日 17:09, 一周内放款,本人为置换房屋出售旧房，并于3月23日完成过户。而买方在宁波银行上海青浦支行通过贷款审批，申请的114万房贷迟迟未见到账。期间本人三次致电青浦支行询问放款日期，该行业务人员分别答复5月底，6月初及6月10日放款，但至今仍未见房贷发放。而新购的房产必须于6月20日前付清房款，上家近期已开始催促，逾期将赔付近百万的违约金。新房的交款期限近在眉睫，急盼的房贷却被宁波银行一拖再拖，近半个月全家都搞得人心惶惶，对我们一家人的生活造成了严重的影响。
 随心分预收罚金,宁波银行,2021年06月11日 12:49, 书面改公章公开道歉,宁波银行随心分业务预扣，可能产生的违约金额17955.68元，导致我还清所欠金额后依然欠款，请宁波银行公开说明书面说明情况，为何可以扣未产生的费用？难道银行可以预知我没法还款？你们客服中心说流程是没问题的，流程就是可以扣可能产生的费用这个合理？
" 快4个月不放贷,侵占",宁波银行,2021年06月11日 11:16," 解释,改善服务,放贷",今年两月中旬上家与宁波银行上海金山支行签订了房屋抵押贷款合同，贷款人王x进：321088197***xxxxx，作为房东已经订新房签好了订金合同，没有宁波银行的放款没办法进行首付网签，已过三月多，开发商都要准备收回房屋并告知我已经违约，宁波银行多次故意拖欠贷款放款时间，至今已经过去三个多月，其他银行都差不多放款，宁波银行答应好几次放款但还是继续拖欠，宁波银行契约精神何在？百姓怎能安居？
 拒绝协商还款,宁波银行,2021年06月10日 03:17, 协商还款,此前因为资金需要，开通宁波银行直接贷，今年因为债务暴发，导致逾期，此前银行工作人员有打过电话，帮我处理过一次，此次逾期纯属个人原因，今日接到贵行工作人员的电话，要求我一次性还清欠款并给我发了律师涵，金额实在超过本人能力，在我电话畅通的情况下给我的家人打了电话，严重影响家庭关系，我跟工作人员沟通的时候一直在说，我欠下的钱我一定会还，不是故意逾期，感谢之前帮我处理的工作人员。在此希望贵行可以考虑我的情况，本人承认在贵行所借债务，也愿意还款，但一次性还清实在超出我的能力，希望贵行可以给出一个还款计划，本人愿意还款，谢谢
 催收问题,宁波银行,2021年06月09日 16:32," 解释,赔偿",2019年宁波银行直接贷客服人员致电给我办理直接贷业务，当时我正好也需要这笔钱，所以就办理了，后年因为疫情原因及公司原因未能偿还贷款，当时贷款总计30000元，剩余10000多块，宁波银行委托催收公司天天打电话，下发文件到我公司及我家里，由于我母亲有心脏病，我警告他们，我母亲有心脏病，请不要骚扰他，可宁波银行委托方还是下发文件到我家里，不至1次下发，当我母亲接受到文件的时候，担心我，当场离世，目前为止我以还清宁波银行直接贷所有款项，但是宁波银行害我家破人亡，请问怎么处理？目前还有宁波银行客服推销直接贷业务，骚扰电话，请官方对我反馈的问题及时处理，最近我也在咨询相关法律师..
 提前结清,宁波银行,2021年06月01日 09:17, 结清,提前结清，最后两期提前结清，结清证明，服务费高
 退款,宁波银行,2021年05月28日 23:13, 赔偿,2018年宁波银行工作人员到我单位推销信用卡万礼金业务，说的天花乱坠，后续一直打电话来推销。2020年九月份，在工作人员推销下，我申请了该业务，但后来发现该业务利息其实很高，我想申请提前还款，但是却要极高的手续费，未还本金的3%，这个比例在其他银行人员看来比高利贷还高，我强烈要求宁波银行免除提前还款手续费！！！一笔已经申请的五百多块 ，还有一笔5400元。工作人员只知道宣传这个好，完全不告知提前还款还需要手续费！！！
 信用卡协商还款,宁波银行,2021年05月28日 04:49, 能够协商分期还款,本人因前段时间投资失败，宁波银行信用卡汇通卡欠款11万左右，利息以及违约金目前实在没有能力每月还款那么多所以导致逾期接近2个月，卡片大概用了1年被银行冻结然后才有的逾期，总额度16万，目前已经还进去5万多。之前也曾多次主动打电话要求协商分期还款，宁波银行拒绝协商，并且多次电话催收，威胁说提交到法务部门处理，我也不是说不还，只是目前没能力还那么多。希望能够帮忙协商处理一下
 泄露客户信息,宁波银行,2021年05月27日 12:50, 改善服务,此号码只在他家办过银行卡，没有绑定其他银行卡，如今个人信息泄露。
" 私自扣款,资金流失,无人告知",宁波银行,2021年05月26日 19:53," 改善服务,利息免除",办理尊尚卡，说没有手续费，利率不高，金额也大。某次需要周转60万，几天后钱一次性全部还入尊尚卡，就不在管银行卡，每次短信也是告知账款还清，也没去细看。银行没有告知还需要操作随心分，也没有业务员提醒，一直在扣钱，一年到期，发短信，说欠款20多万，立即打电话说欠款差不多6万。同时期，还建行，一次性成功，业务员跟进。@宁波银行，请问你们怎么处理。中年人的危机，房贷车贷，小孩各种费用，这突然又来6万，我真是！！！！
 功能限制,宁波银行,2021年05月26日 19:47, 改善服务,我没有在宁波银行留过任何身份信息，为什么宁波银行的给我打电话说我要借款，我什么时候说我需要资金了 我的信息他们是哪里来的.我有录音。
 与银行协商还款被敷衍,宁波银行,2021年05月25日 16:05, 银行同意个性化分期,去年年底由于个人工作问题，失去经济来源，迫不得已造成贷款逾期，逾期后与银行客服积极沟通协商，但是得不到解决。现在的精神压力和资金压力太大，希望银行可以同意个性化分期。
 拒绝协商还款,宁波银行,2021年05月24日 16:47, 允许协商还款,由于本人于今年3月份从原公司离职，一直未找到合适的工作，失去了收入来源，所以贷款没办法及时偿还，造成逾期，而且我父母都已经年迈，身体不好，没有偿还能力，在我逾期后宁波银行客服也打电话告知我账单逾期，请及时还款，我这边也是积极配合想办法去还款，然后后续没能还上，宁波银行也是继续打电话告知我及时还款，一直到5月份宁波银行没有再打电话，而是直接把律师函寄到了家里，造成我家人精神和心理严重受损，我后面主动联系宁波银行协商还款，该银行客服和我说没有这个业务，只能按照要求将钱还上，并且只能走流程，如果处理不了就会进入起诉流程。我有这个还款意愿，但是宁波银行却拒绝我的诉求，现向黑猫投诉该银行。
 客服不同意协商,宁波银行,2021年05月24日 15:37, 协商分期还款,一共欠宁波直接贷44746元，逾期9000元，其余还没到期，我现在累计欠款金额已超出我的还款能力，我想偿还但还是能力有限，想跟银行协商分期还款。我现在每个月工资4500左右，每个月全部还进去了。已经把朋友都借了一遍。实在没办法还了，希望贵银行能给我这个机会，制定一个个性化的分期还款。希望贵公司同意我的请求。我这个月已经还了4600元我现在累计欠款金额已超出我的还款能力，我想偿还但还是能力有限，想跟银行协商分期还款。希望贵银行能给我这个机会，制定一个个性化的分期还款。希望贵公司同意我的请求。
" 虚假宣传,年化利率28.5%",宁波银行,2021年05月23日 14:08," 改善服务,重新计算手续费",万利金在宣传的时候讲的很好，月息0.6%，如果通过这样方式计算的话，年利率7.2%是没有错，但这是建立在先息后本的前提下，宁波银行万利金的实际计息方式是不管还了多少本金，最终都是仍然按照初始本金来计息的，这样算下来最终年化利率28.5%，试问有多少非银行或非财务等领域的人会这么精通利率的计算方式？在他们强调月息0.6%，避重就轻，不去和你讲所谓的实际年化利率时，又有多少万利金用户能清楚它的实际利率呢？在黑猫平台随便搜索万利金就有如此多的投诉记录，不得不对宁波银行的宣传及讲解产生怀疑，是否存在避重就轻，是否存在混淆概念的现象？提前还款还需要支付高达剩余本金3%的违约金，当初办理了宁波银行的万利金，业务经理说有最大力度的优惠券，7折，以后没有比这个最低的优惠券了，而且很快就过期，催着办理贷款，结果我就办理万利金了，后来才发现陆续又有5折，4折的优惠券，宁波银行存在严重的虚假宣传，误导消费者情况误导消费者，隐瞒重要信息！
 虚假宣传，高利贷,宁波银行,2021年05月20日 21:03, 免手续费结束合约,宁波银行给我致电，说我是优质客户，可享受五折贷款优惠月息0.28%，我反复和他确认，那年息就是3%多一点最后业务办理成功之后，我进行核算，发现与他宣传的年息3%相差太多。实际利率年息6.7%我要求提前还款，按银行同比利率计息，然后取消合同否则将继续向银保监等部门继续投诉到底
 拖延放款,宁波银行,2021年05月19日 17:48," 赔偿,赔偿中间造成的经济损",我的房子一月份出售给买家，买家通过中介介绍的宁波银行贷款按揭160万，2月19过户房屋抵押给银行，起初说过完户3天就放款，后来又说要到4月15左右，我这边因为银行说几天就放款所以二月15号已经定好了房子付了定金，等银行贷款下来付首付款答应房东3月16付首付，后因银行未放款和房东协商拖延到4月25日，等到了时间银行还是没有放款，贷款人到银行催问答应5月15号之前一定给予放款，我这边没办法只能通过网商贷借贷，和亲戚朋友借款凑齐首付给了房东，现在每天几百元的利息在产生，到5月8号银行那边终于说要放款了可是一直等到9号打电话过去又说没有通过，说被银监会管控了，政策变化他们也没办法，后让我们等到15-18号之间说肯定放款，18号下午去电又说等19号，今天19号打过去询问回复说已经帮忙申请，下不下来她们也不知道，一直在推诿欺骗，这期间已经照成我个人经济损失6000余元，答应亲朋好友还款的时间也过来造成名誉损失，让我失信于人。本人卖方，叶方学330327********3492，贷方武春花362526********5322 。希望平台帮忙沟通协调早日处理，万分感谢
 提前还款收手续费,宁波银行,2021年05月18日 14:42, 免除手续费,宁波银行的万利金业务不是贷款，属于分期付款，利息计算方式和贷款完全不一样，时间越久利息越高，后面利息远远高于宣传不知道多少倍，存在欺诈行为。我要求办理提前还款，却要求高达3%的提前还款手续费，利率跟实际严重不符，早还款要收很高手续费。现我要求提前还款，并免于支付提前还款手续费！
 还款问题,宁波银行,2021年05月16日 14:54, 个性化分期,本人因资金链断裂，直接贷无力已经无力还款，和工作人员积极沟通无果，现在资金压力太大，想和银行协商个性化分期，希望银行能同意！
 宁波银行房贷不放款,宁波银行,2021年05月13日 23:33, 银行尽快放款,"你们好！我们卖了房子后定了新房，我们二手房贷款买方是在宁波银行卢湾支行办的，从今年1月30号开始苦苦等待银行放款，到现在已经四个月过去了，还是没有放款。其间我们多次询问银行工作人员，一开始答复四月中旬能放，后来他们的答复是：银监会管控，没有放款额度。我电话打到银监会再打到人民银行再打到12345都说不归他们管，真的是太难太难了，我相信任何国家机构都是为了人民群众对美好生活的向往而服务的。你们银行既然接了我们的单子就要对我们负责，做人做事既要讲诚信负责任又要讲口碑，我现在急需资金付新房款，不然几十万定金就没有了，宁波银行迟迟不放款，对我们生活和经济带来了很大的影响，希望宁波银行能凭良心为我们小老百姓考虑一下尽快放款。贷款方:吕禕蕾,身份证号码：310109********1023；马上都建党100周年了，就这么为老百姓服务的吗？"
" 额度,续卡,征信",宁波银行,2021年05月12日 20:49," 额度恢复,销户,给说法",十几年前办理了多张宁波信用卡却从未开通，期间也从未收到过银行电话和短信，前段时间拉取征信报告居然显示还有几张卡正常，而且额度为1，从来没激活，没有收到续卡短信，也没有拿到过卡片，难道卡片有效期十几年吗？额度变化没有通知的吗，这样的状态严重影响我的征信，我要求宁波银行必须给我一个说法，到底哪条监管条例允许的？
 拖延放贷不守信,宁波银行,2021年05月11日 16:54," 改善服务,赔偿",本人是房屋卖方，2021年1月18日与买方签订购房合同并于3月3日完成过户，后买方通过宁波银行上海金桥分行贷款审批，银行王洁勤业务经理承诺说过户后两周即可放款，后来又称年后会放款，现在迟迟不放款，连等待时间也没有，已过两个多月，我想知到为什么迟迟没有放款？到底什么时候能放款？因本人为置换房产，新购房产需近期付款，没有首付，将损失定金，急切盼着买方的贷款能下来！！之前投诉银行私人来电说五月初一定全部放款，如今又说等额度，组合贷，100w公积金部分也故意卡扣，170w商贷更无消息，做法十分不合理，更没合理解释！！！
 虚假宣传,宁波银行,2021年05月11日 12:23, 解释,"我没贷款过宁波银行、可突然有条消息我有贷款、可是今天突然有条宁波银行的还款消息,还有更奇怪的是电话是我的,名字是我父亲的,的怕你他们解释下。他们客服电话打不通"
 钓鱼纠纷,宁波银行,2021年05月11日 09:35," 解释,改善服务",如果影响我的信誉，如果不联系我，说明清楚，导致本人未还款逾期，请此企业负全责.
" 客服服务态度差,直接待逾期协商,直接待",宁波银行,2021年05月10日 15:00, 协商还款,由于2020年疫情开始，投资生意失败。需要资金周转，在短信中看到一条宁波银行直接贷的信息，可贷11.9万。该银行在借贷时就发了一条短信，然后我登入APP就可以申请，都没有任何电话审核，就把钱借给我了。然后就借贷出来使用。由于长时间的亏损，在2020年10月份与宁波银行直接贷电话客服联系，告知情况后问能不能协商还款，银行处理人员后续告知可以帮我调整一次，后续问我需不需要使用，只有一次申请机会。想了后又决定坚持了一下，一直坚持到2021年4月份，债务爆发，已经无法按期还款了。之前由于以贷还贷，从原先本金11.9万元的利息，已经累计到需要总共要还19.5万元的利息了。经过多次协商，电话客服和银行APP客服都表示无法协商。对于银行业务的办理审核和逾期后协商的态度，进行投诉。本人也想回归正常的生活，希望投诉进度能快一点，这样就可以专心赚钱还款。
 协商还款,宁波银行,2021年05月08日 19:43, 减免费用,由于本人收入不足，所以贷款没办法及时偿还，造成逾期，而且我父母都已经退休多年，没有偿还能力，在我逾期后宁波银行客服打电话给我家人并多次上门前往我工作地点和我家中催款，造成我家人精神和心理严重受损，我后面主动打电话和宁波银行协商还款，该银行客服和我说没有这个业务的，并且继续起诉流程。我有这个还款意愿，但是宁波银行却拒绝我的诉求，现向黑猫投诉该银行
 资金流失,宁波银行,2021年05月05日 20:00," 改善服务,赔偿",2021年3月16日，本人在北京经历电信欺诈，通过宁波银行手机APP，临时申请宁波银行万利金信贷业务转账至其他账户，直接损失5万元，于当日晚上在北京市大兴区光华路派出所报警备案，本人认为宁波银行一定程度上存在安全隐患，从而间接导致本人被欺诈过程完成，因此于3月17日与宁波银行电话人工客服沟通以下问题，希望其反馈给总部，给出解释和承担责任：1.本人认为宁波银行手机APP存在安全隐患，间接导致客户蒙受损失；具体原因为本人经历的欺诈过程使用腾讯会议APP进行，被诱导使用手机银行转账，本人使用了建设银行，工商银行和宁波银行等手机APP尝试转账，其它银行手机APP登录后，腾讯会议APP自动退出，会议过程中止；而宁波银行手机APP登录后未中止腾讯会议APP，间接使得犯罪分子得逞；2.本人认为宁波银行万利金信贷机制存在安全隐患，临时申请大额万利金信贷业务，申请成功28万元（5万转账至其它账户），申请过程中未收到人工电话信息确认；3.本人认为宁波银行信贷审核机制存在安全隐患，具体原因是本人于2019年5月申请宁波银行信用卡，按照正常1年的审核周期，至事件发生时信贷资质已经过期10个月左右，本人此时已经承担多重债务，宁波银行未进行资质确认，保留信贷额度。宁波银行人工客服答应将问题反馈至总部并于3日内给予回复，本人于3月26日（比答应正常反馈时间晚6天）接到宁波银行电话回复，回复内容为我被欺诈过程中的手机操作申请信贷业务和转账正常，未对本人提出的几个问题作出正面回应，本人因此申请投诉。
" 功能限制,资金流失",宁波银行,2021年05月05日 13:38," 解释,改善服务",由于疫情，和突发一些情况，又才失业，没有收入来源，导致一直借了在还，还了在借，现在一个月需要还款五千多，实在还不起了，打宁波银行客服电话，多次需要重组贷款，重新分期，修改还款日，就是不愿意，这么大的银行，一点点为民服务都没有，请求重新更换还款日，重组贷款，给老百姓一个方便，谢谢。
 高利贷 ,宁波银行,2021年05月04日 10:36," 退款,只还正常利息部分",总借款8000元，分12期，每期797.71，包含每期固定保费107.37和利息，总还款9572.52，借款费用高达1572.52，认为不合理，本人愿意承担利息和本金，而且我也已经还了11期，要求退还之前收取的保费
" 催收联系紧急联系人,恶意催收,拒绝协商延期还款",宁波银行,2021年04月29日 15:38," 协商延期还款,确认工作人员",我是去年在翼支付平台借款15000  由于去年疫情 薪资都变少了 年后主动跟银行客服联系 有工作变动 稳定了会及时协商还款 老接收到催收人员电话 有时候座机有时候手机 反馈多次 目前没有自足够资金还款 需要给我一些时间稳定了会及时还进去 今天接到工作人员电话我也把情况说了 威胁我要起诉要怎么招的 上周有一个宁波银行的用手机跟我联系说是可以 现在又说不行 反馈多次没有一个明确的回复我这边稳定了会及时协商 没有多少钱也不是说不还了 我希望黑猫可以帮我反馈做主
 恶意催收,宁波银行,2021年04月29日 11:49," 改善服务,道歉",之前在借贷平台接了他们的款项，犹豫家里状况出现问题逾期了，他们联系我，我也有接他们电话，跟他们协商是5月15日还上，协商不成，以起诉等威胁，在可以联系到本人的情况下，恶意爆通讯录，恶意骚扰，对家人跟朋友造成困扰，要求道歉，不然会继续投诉，不行就银监会投诉
 总收到骚扰电话和短信,宁波银行,2021年04月29日 09:57, 请解决骚扰电话和短信,现在希望不要再收到信息电话骚扰。现在也不用打电话回复。直接给我把号码号码屏蔽
 高利贷年化超36%,宁波银行,2021年04月26日 14:07," 退款,改善服务",4.1宁波银行万利金先息后本贷款100***元，4.26提前全额还款11500元，然后下期还要支付1500利息，一个月不到居然要3000的利息，年化利率超36%，是不是合法的
 房贷迟迟不发放,宁波银行,2021年04月22日 17:58, 请及时放款,我是宁波银行忠实客户，今年一月在宁波银行上海长宁支行办理房贷，于2月24日办理并移交他项证。截止目前已经快2个月了，还没有放款，工作人员也无法给出放款时间，我从2月份起开始租房，给生活带来极大的不便，并且离合同约定的时间越来越近，到期卖家未收到款，我还需支付滞纳金，违约金，这些额外的经济损失。请各位领导体谅并解决放款，谢谢
 超高罚息，违规催收,宁波银行,2021年04月21日 10:38, 协商还款,本人通过京东金融平台申请的宁波银行直接贷，因为家庭发生变故导致资金周转困难，贷款发生逾期，待还本金为4300左右，现在罚息已经高达近千元，并且第三方催收在可以联系本人的情况下给第三人打电话进行催收，导致本人名誉受损，现在本人要求第三方催收停止骚扰除本人以外的任何第三人，否则本人将通过自己的渠道进行维权。另外，高额罚息部分希望银行能考虑到本人的实际情况给予减免，感谢黑猫平台支持！违规催收电话057489077***
 额度冻结，拒绝协商,宁波银行,2021年04月20日 14:13, 希望贵行能同意协商,2020年6月份左右，银行电销打电话来说有20万额度，可以循环使用，额度有效期3年，后来报了身份证号码啥的。给了42000额度，用了一段时间，然后2021年3月份左右，额度停了，导致资金问题，找客服协商，然后银行告知不能协商，如果实在还不上，就只能逾期。本人有还款意愿。希望贵行能同意协商还款。谢谢
